<?xml version="1.0" encoding="UTF-8"?>
<!--Sample XML file generated by XMLSpy v2007 sp2 (http://www.altova.com)-->
<Configuration xsi:noNamespaceSchemaLocation="src/rph/labyrinth/ontology/configuration.xsd" xmlns:xsi="http://www.w3.org/2001/XMLSchema-instance" player="rph.labyrinth.players.iliusvlaPlayer" windowLeft="0" windowTop="50" windowWidth="800" windowHeight="600">
	<Map name="maps/easy/easy1.bmp" />
	<Map name="maps/easy/easy2.bmp" />
	<Map name="maps/easy/easy3.bmp" />
	<Map name="maps/easy/easy4.bmp" />
	<Map name="maps/easy/easy5.bmp" />
	<Map name="maps/easy/easy6.bmp" />
	<Map name="maps/easy/easy7.bmp" />
	<Map name="maps/easy/easy8.bmp" />
	<Map name="maps/normal/normal1.bmp" />
	<Map name="maps/normal/normal2.bmp" />
	<Map name="maps/normal/normal3.bmp" />
	<Map name="maps/normal/normal4.bmp" />
	<Map name="maps/normal/normal5.bmp" />
	<Map name="maps/normal/normal6.bmp" />
	<Map name="maps/normal/normal7.bmp" />
	<Map name="maps/normal/normal8.bmp" />
	<Map name="maps/hard/larger.gif" />
</Configuration>
